id,question_id,answer,domain
173,18,"Obtain written consent from customers before using their testimonials in marketing materials. Clearly communicate how their testimonials will be used.","Obtain Permission"
174,18,"Implement a verification process to confirm the authenticity of testimonials. Contact customers to validate their statements if necessary.","Verify Testimonials"
175,18,"Disclose any material connections between the individuals providing testimonials and the company, such as if they are employees or affiliates.","Disclose Material Connections"
176,18,"Transparency about relationships helps maintain trust.","Disclose Material Connections"
177,18,"Do not misrepresent or alter the content of testimonials in a way that distorts the original message or intent.","Do Not Misrepresent"
178,18,"Feature a diverse range of testimonials that reflect the various experiences and perspectives of customers.","Diverse Testimonials"
179,18,"Avoid cherry-picking only the most positive testimonials.","Diverse Testimonials"
180,18,"Train employees involved in marketing and advertising on ethical practices, including the use of testimonials.","Educate Employees"
181,19,"Ensure that all products meet or exceed safety standards, regulatory requirements, and industry best practices.","Product Safety Standards"
182,19,"Implement rigorous quality control processes to minimize the risk of harm.","Product Safety Standards"
183,19,"Clearly and accurately label products with all relevant safety information, warnings, and instructions for safe use.","Transparency and Disclosure"
184,19,"Provide accessible and comprehensive information about potential risks associated with the product.","Transparency and Disclosure"
185,19,"Avoid misleading or deceptive marketing practices that downplay potential risks or exaggerate product benefits.","Responsible Marketing"
186,19,"Communicate honestly and transparently about the product's attributes and limitations.","Responsible Marketing"
187,19,"Subject products to thorough testing and certification processes to ensure their safety and compliance with applicable regulations.","Product Testing and Certification"
188,19,"Regularly update products to meet evolving safety standards.","Product Testing and Certification"
189,19,"Establish a recall and remediation plan for addressing any safety issues or defects promptly.","Recall and Remediation"
190,19,"Take immediate action to notify customers and regulators if a product is found to be harmful.","Recall and Remediation"
191,20,"Ensure that all marketing and advertising materials accurately represent the product's features, capabilities, and limitations.","Truthful Marketing and Advertising"
192,20,"Avoid false claims, exaggerations, or deceptive tactics.","Truthful Marketing and Advertising"
193,20,"Provide clear, detailed, and accurate product descriptions on your website and in product documentation, including user manuals and specifications.","Clear and Accurate Product Descriptions"
194,20,"Train sales teams and representatives to be honest and transparent when communicating with customers.","Honest Sales Practices"
195,20,"Discourage deceptive sales tactics, including bait-and-switch techniques.","Honest Sales Practices"
196,20,"Set ethical sales targets and expectations that do not encourage or reward misrepresentation.","Ethical Sales Targets"
197,20,"Prioritize long-term customer relationships over short-term sales.","Ethical Sales Targets"
198,20,"Educate customers about the product's features and limitations during the sales process, ensuring they have realistic expectations.","Customer Education"
199,20,"Provide customers with easy ways to provide feedback or report concerns about misrepresentation or product dissatisfaction.","Customer Feedback Mechanisms"
200,20,"Act on customer feedback promptly.","Customer Feedback Mechanisms"
201,21,"Commit to adhering to ethical financial reporting standards, including Generally Accepted Accounting Principles (GAAP) or International Financial Reporting Standards (IFRS), as applicable.","Ethical Reporting Standards"
202,21,"Ensure that financial statements accurately and transparently represent the company's financial performance, position, and risks.","Honest Financial Reporting"
203,21,"Avoid false statements, omissions, or manipulation of financial data.","Honest Financial Reporting"
204,21,"Engage reputable and independent auditing firms to conduct thorough audits of financial statements to verify their accuracy and compliance with accounting standards.","Independent Audits"
205,21,"Promote ethical leadership throughout the organization, with executives and senior management setting an example of honesty and integrity in financial reporting.","Ethical Leadership"
206,21,"Establish robust internal controls to prevent and detect financial fraud, including controls over financial reporting processes and access to financial data.","Internal Controls"
207,21,"Create mechanisms for employees to report concerns about unethical financial practices or fraud.","Whistleblower Protection"
208,21,"Ensure that whistleblowers are protected from retaliation.","Whistleblower Protection"
209,21,"Strengthen the oversight role of the board of directors in financial reporting, including the establishment of audit committees.","Board Oversight"
210,21,"Encourage independent and diligent review of financial statements.","Board Oversight"
211,22,"Establish fair compensation practices that consider the value employees bring to the organization, market conditions, and the organization's financial health.","Fair Compensation Practices"
212,22,"Ensure that employees are paid competitive and equitable wages.","Fair Compensation Practices"
213,22,"Promote ethical leadership that balances the interests of both shareholders and employees.","Ethical Leadership"
214,22,"Demonstrate a commitment to corporate social responsibility (CSR) principles that prioritize the well-being of all stakeholders.","Ethical Leadership"
215,22,"Maintain transparent communication with employees and shareholders about the organization's financial performance, challenges, and goals.","Transparent Communication"
216,22,"Avoid deceptive or misleading communication that may give a false impression of priorities.","Transparent Communication"
217,22,"Develop an ethical decision-making framework that guides leadership in weighing the impact of decisions on employees, shareholders, and other stakeholders.","Ethical Decision-Making Framework"
218,22,"Consider factors such as the potential for harm to employees, societal implications, and long-term sustainability.","Ethical Decision-Making Framework"
219,22,"Engage with employees, shareholders, and other stakeholders to understand their perspectives, concerns, and expectations.","Stakeholder Engagement"
220,22,"Consider their input when making decisions that affect them.","Stakeholder Engagement"
221,23,"Ensure full compliance with securities laws and regulations related to insider trading in the jurisdiction where the company operates.","Strict Legal Compliance"
222,23,"Engage legal counsel to provide guidance on compliance.","Strict Legal Compliance"
223,23,"Conduct educational programs and training for employees, especially those with access to sensitive, non-public information, to raise awareness about insider trading laws and ethical considerations.","Educational Programs"
224,23,"Establish and enforce clear ethical codes of conduct within the organization that explicitly prohibit insider trading and unethical practices related to securities trading.","Ethical Codes of Conduct"
225,23,"Implement strict information segregation measures to prevent unauthorized access to sensitive, non-public information.","Information Segregation"
226,23,"Limit access to confidential information to only those who need it for legitimate business purposes.","Information Segregation"
227,23,"Develop and communicate comprehensive insider trading policies and guidelines to employees, outlining the legal and ethical obligations related to trading securities.","Insider Trading Policies"
228,23,"Require employees to seek pre-clearance for any trading in the company's securities, particularly during periods of heightened sensitivity, such as before earnings releases.","Pre-Clearance Procedures"
229,23,"Implement monitoring and surveillance systems to detect and prevent insider trading activities within the organization.","Monitoring and Surveillance"
230,23,"Conduct regular audits to ensure compliance.","Monitoring and Surveillance"
231,24,"Develop and maintain transparent executive compensation policies that clearly define the criteria, metrics, and performance targets used to determine executive pay.","Transparent Compensation Policies"
232,24,"Ensure that executive compensation is directly linked to performance and achievement of specific, measurable goals that benefit the organization and its stakeholders.","Performance-Linked Compensation"
233,24,"Set a reasonable base salary for executives that reflects market standards and the complexity of their roles while remaining in line with the organization's financial health.","Reasonable Salary Base"
234,24,"Encourage executives to hold equity or stock in the company as a means of aligning their interests with shareholders' long-term value creation goals.","Equity and Stock Ownership"
235,24,"Implement clawback provisions in executive compensation agreements that allow the company to recoup excessive pay if financial restatements or unethical behavior come to light.","Clawback Provisions"
236,24,"Establish independent compensation committees composed of board members who are not executives or employees of the company.","Independent Compensation Committees"
237,24,"These committees can review and approve executive compensation to ensure fairness and transparency.","Independent Compensation Committees"
238,24,"Seek input from shareholders regarding executive compensation policies and proposals.","Shareholder Input"
239,24,"Engage in a dialogue with shareholders to address concerns and gather feedback.","Shareholder Input"
240,24,"Conduct comparative analyses of executive compensation with peer companies to ensure that packages are competitive but not excessively generous.","Comparative Analysis"
241,25,"Strictly adhere to the payment terms and conditions agreed upon with suppliers.","Honor Agreed-Upon Terms"
242,25,"Ensure payments are made within the specified timeframes.","Honor Agreed-Upon Terms"
243,25,"Implement effective cash flow management practices to maintain liquidity without resorting to delaying payments to suppliers.","Effective Cash Flow Management"
244,25,"Explore other methods to improve cash flow, such as optimizing inventory levels, reducing operating expenses, or negotiating better credit terms with financial institutions.","Effective Cash Flow Management"
245,25,"Maintain open and transparent communication with suppliers regarding payment schedules and potential delays.","Communication with Suppliers"
246,25,"Discuss any financial difficulties or challenges that may impact payment timelines.","Communication with Suppliers"
247,25,"If facing cash flow issues, proactively negotiate revised payment terms with suppliers that are mutually acceptable.","Negotiate Payment Terms"
248,25,"Seek to establish win-win solutions that benefit both parties.","Negotiate Payment Terms"
249,25,"Prioritize building and maintaining strong relationships with suppliers based on trust, reliability, and fair treatment.","Supplier Relationships"
250,25,"Recognize the long-term value of these relationships.","Supplier Relationships"
251,26,"Demonstrate a clear and unwavering commitment to diversity and inclusion as core values of the organization.","Commitment to Diversity and Inclusion"
252,26,"Communicate the importance of diversity to all employees and stakeholders.","Commitment to Diversity and Inclusion"
253,26,"Establish diverse hiring panels that reflect a range of backgrounds, experiences, and perspectives to ensure unbiased evaluations of candidates.","Diverse Hiring Panels"
254,26,"Review and revise job descriptions to use inclusive language and remove any bias-inducing language or requirements that are not essential to the job.","Inclusive Job Descriptions"
255,26,"Implement recruitment processes that are free from bias and discrimination.","Unbiased Recruitment Process"
256,26,"Use standardized interview questions and evaluation criteria.","Unbiased Recruitment Process"
257,26,"Provide diversity and inclusion training for all employees involved in the hiring process to raise awareness of unconscious biases and promote fair decision-making.","Diversity Training"
258,26,"Actively seek out diverse candidates through a variety of sourcing methods, including targeted outreach, partnerships, and networking.","Diverse Candidate Sourcing"
259,26,"Set specific diversity goals and metrics for hiring and regularly assess progress toward those goals.","Diversity Goals and Metrics"
260,26,"Hold leaders and hiring managers accountable for meeting these objectives.","Diversity Goals and Metrics"
261,27,"Implement hiring practices that are free from bias and discrimination. Train all employees involved in the hiring process to recognize and mitigate biases.","Unbiased Hiring Practices"
262,27,"Establish diverse hiring panels that include individuals from various backgrounds, experiences, and perspectives to minimize the impact of biases.","Diverse Hiring Panels"
263,27,"Use standardized interview questions and evaluation criteria to ensure that all candidates are assessed consistently and objectively.","Standardized Evaluation Criteria"
264,27,"Provide diversity and inclusion training for all employees involved in the hiring process to raise awareness of unconscious biases and promote fair decision-making.","Diversity and Inclusion Training"
265,27,"Consider implementing blind recruitment practices, where identifying information that could lead to bias is temporarily removed from resumes and applications.","Unbiased Hiring Practices"
266,27,"Set specific diversity and inclusion goals and metrics for hiring and regularly assess progress toward those goals. Hold leaders and hiring managers accountable for meeting these objectives.","Unbiased Hiring Practices"
267,27,"Maintain transparency in the hiring process by clearly communicating selection criteria and decisions to candidates. Offer constructive feedback to candidates.","Unbiased Hiring Practices"
268,27,"Include diversity and inclusion statements in job postings and on the company's website to signal a commitment to diversity and non-discrimination.","Unbiased Hiring Practices"
269,27,"Conduct regular audits and assessments of the organization's hiring practices to identify and rectify any biases or barriers to diversity and inclusion.","Unbiased Hiring Practices"
270,27,"Ensure full compliance with anti-discrimination laws and regulations governing hiring decisions. Seek legal counsel to ensure policies and practices are in line with the law.","Unbiased Hiring Practices"
271,28,"Develop professional development policies and programs that are inclusive and open to all employees, regardless of their background or characteristics.","Inclusive Professional Development Policies"
272,28,"Provide diversity and inclusion training to all employees and managers involved in professional development decisions to raise awareness of unconscious biases and promote fairness.","Inclusive Professional Development Policies"
273,28,"Select participants for professional development opportunities based on merit, skills, qualifications, and potential for growth, rather than personal characteristics.","Inclusive Professional Development Policies"
274,28,"Establish diverse selection panels or committees responsible for evaluating candidates for professional development opportunities to minimize bias and promote objectivity.","Inclusive Professional Development Policies"
275,28,"Communicate clearly and transparently about professional development opportunities, eligibility criteria, and selection processes.","Inclusive Professional Development Policies"
276,28,"Ensure that employees understand how they can apply and what is expected of them.","Inclusive Professional Development Policies"
277,28,"Implement mentorship and sponsorship programs that pair employees with mentors or sponsors who can support their career growth and development, regardless of their background.","Inclusive Professional Development Policies"
278,28,"Consider implementing affirmative action programs or initiatives that actively promote underrepresented groups' participation in professional development opportunities to address historical disparities.","Inclusive Professional Development Policies"
279,28,"Set specific diversity and inclusion goals and metrics for professional development programs and regularly assess progress.","Inclusive Professional Development Policies"
280,28,"Hold leaders and managers accountable for achieving these objectives.","Inclusive Professional Development Policies"
281,29,"Demonstrate a clear and unwavering commitment to diversity and inclusion as core values of the organization.","Commitment to Diversity and Inclusion"
282,29,"Communicate the importance of diversity and inclusion to all employees and stakeholders.","Commitment to Diversity and Inclusion"
283,29,"Ensure diversity in leadership positions to set an example and provide diverse perspectives in decision-making.","Commitment to Diversity and Inclusion"
284,29,"Develop and implement inclusive policies and practices that prevent discrimination and promote diversity.","Commitment to Diversity and Inclusion"
285,29,"Conduct regular assessments to identify and rectify any unwelcoming or biased practices.","Commitment to Diversity and Inclusion"
286,29,"Provide diversity and inclusion training for all employees to raise awareness of unconscious biases, promote understanding, and encourage inclusive behavior.","Commitment to Diversity and Inclusion"
287,29,"Establish a zero-tolerance policy for discrimination, harassment, and unwelcoming behavior.","Commitment to Diversity and Inclusion"
288,29,"Ensure that employees are aware of the policy and reporting mechanisms.","Commitment to Diversity and Inclusion"
289,29,"Implement diverse hiring and promotion practices that prioritize equal opportunity and the consideration of candidates from various backgrounds.","Commitment to Diversity and Inclusion"
290,29,"Encourage the formation of employee resource groups (ERGs) and affinity groups that allow employees to connect, share experiences, and contribute to an inclusive workplace culture.","Commitment to Diversity and Inclusion"
291,30,"Demonstrate a strong commitment to equal opportunity and inclusivity as fundamental principles of the organization.","Commitment to Equal Opportunity"
292,30,"Provide disability awareness and sensitivity training to all employees to raise awareness of the needs of disabled colleagues and promote a culture of inclusion.","Commitment to Equal Opportunity"
293,30,"Ensure full compliance with disability rights laws, including the Americans with Disabilities Act (ADA) in the United States and similar laws in other jurisdictions.","Commitment to Equal Opportunity"
294,30,"Establish clear policies and processes for identifying and providing reasonable accommodations to disabled employees.","Commitment to Equal Opportunity"
295,30,"Engage in an interactive process with employees to determine the specific accommodations they may need.","Commitment to Equal Opportunity"
296,30,"Ensure that physical facilities and digital resources are accessible to employees with disabilities, including wheelchair ramps, accessible restrooms, and screen reader-friendly websites.","Commitment to Equal Opportunity"
297,30,"Offer flexible work arrangements, such as remote work options or adjusted work hours, to accommodate disabled employees' needs.","Commitment to Equal Opportunity"
298,30,"Provide accessible communication formats for employees with disabilities, such as braille materials, sign language interpreters, or accessible documents.","Commitment to Equal Opportunity"
299,30,"Offer mentoring and support programs for disabled employees to help them succeed in their roles and advance their careers.","Commitment to Equal Opportunity"
300,30,"Establish a zero-tolerance policy for discrimination or harassment based on disability or related accommodations.","Commitment to Equal Opportunity"
301,31,"Be transparent with employees about the use of monitoring software. Clearly communicate the reasons for its implementation and how it will be used.","Transparency and Communication"
302,31,"Inform employees about the specific data that will be collected and monitored.","Transparency and Communication"
303,31,"Obtain informed consent from employees before implementing monitoring software. Ensure they understand what the software will track and how the data will be used.","Transparency and Communication"
304,31,"Allow employees to opt-in or opt-out of certain monitoring practices when possible.","Transparency and Communication"
305,31,"Ensure that the use of monitoring software complies with all applicable privacy laws and regulations in your jurisdiction.","Transparency and Communication"
306,31,"Seek legal counsel to ensure compliance with relevant laws, such as the General Data Protection Regulation (GDPR) in Europe or the Health Insurance Portability and Accountability Act (HIPAA) in the United States.","Transparency and Communication"
307,31,"Limit the scope of monitoring to what is necessary for legitimate business purposes, such as security, productivity, or compliance.","Transparency and Communication"
308,31,"Avoid excessive or intrusive monitoring that goes beyond what is necessary.","Transparency and Communication"
309,31,"Implement strong data protection measures to safeguard the collected data and prevent unauthorized access or breaches.","Transparency and Communication"
310,31,"Regularly audit and assess data security practices.","Transparency and Communication"
311,32,"Obtain informed and voluntary consent from employees before sharing their personal information with third parties. Clearly communicate the purpose and scope of the sharing.","Obtain Informed Consent"
312,32,"Ensure that any sharing of employee personal information complies with all applicable data protection laws, such as the General Data Protection Regulation (GDPR) in Europe or the Health Insurance Portability and Accountability Act (HIPAA) in the United States.","Obtain Informed Consent"
313,32,"Limit the sharing of personal information to legitimate and necessary business purposes. Avoid sharing information with third parties unless there is a clear and justifiable reason.","Obtain Informed Consent"
314,32,"Implement robust data security measures to protect employee personal information from unauthorized access or breaches when shared with third parties.","Obtain Informed Consent"
315,32,"Establish data protection agreements or contracts with third parties that specify the terms, conditions, and safeguards for handling and protecting employee personal data.","Obtain Informed Consent"
316,32,"Minimize the sharing of personal information to the extent possible, sharing only the specific data required for the intended purpose.","Obtain Informed Consent"
317,32,"Be transparent with employees about the sharing of their personal information with third parties. Notify them of the nature of the sharing, who the third parties are, and the safeguards in place.","Obtain Informed Consent"
318,32,"Inform employees about their rights to access and request the deletion of their personal information. Ensure that they can exercise these rights easily.","Obtain Informed Consent"
319,32,"Develop and communicate clear privacy policies to employees that outline how their personal information is handled and shared within the organization and with third parties.","Obtain Informed Consent"
320,32,"Conduct regular audits and assessments of data-sharing practices to identify and rectify any potential privacy breaches or non-compliance with ethical standards and regulations.","Obtain Informed Consent"
321,33,"Develop clear and well-defined social media policies that outline the organization's expectations regarding employee behavior on social media.","Establish Clear Policies"
322,33,"Only request access to employees' personal social media accounts when there are legitimate business reasons, such as investigations into workplace misconduct or potential security risks.","Establish Clear Policies"
323,33,"Request access to personal social media accounts only with the informed and voluntary consent of employees.","Establish Clear Policies"
324,33,"Clearly communicate the reasons for the request and how the information will be used.","Establish Clear Policies"
325,33,"Ensure that any access requests comply with applicable privacy and data protection laws, which may vary by jurisdiction.","Establish Clear Policies"
326,33,"Seek legal counsel to ensure compliance with relevant regulations.","Establish Clear Policies"
327,33,"Limit access to specific information or posts that are relevant to the legitimate business reason, rather than accessing an entire account.","Establish Clear Policies"
328,33,"Implement strong data security measures to protect any personal information accessed during investigations or other legitimate reasons.","Establish Clear Policies"
329,33,"Establish mechanisms for employees to report concerns about social media access requests or misuse of their personal information.","Establish Clear Policies"
330,33,"Ensure that whistleblowers are protected from retaliation.","Establish Clear Policies"
