id,question_id,answer,domain
331,34,"Develop clear and well-communicated internet usage and email policies that outline the organization's expectations regarding employee behavior.","Establish Clear Usage Policies"
332,34,"Only monitor internet usage and emails when there are legitimate business reasons, such as security concerns, compliance with regulations, or investigations into misconduct.","Establish Clear Usage Policies"
333,34,"Seek informed and voluntary consent from employees before implementing monitoring practices.","Establish Clear Usage Policies"
334,34,"Clearly communicate the reasons for monitoring, the types of information collected, and how the data will be used.","Establish Clear Usage Policies"
335,34,"Ensure that any monitoring activities comply with applicable privacy and data protection laws, which may vary by jurisdiction.","Establish Clear Usage Policies"
336,34,"Seek legal counsel to ensure compliance with relevant regulations.","Establish Clear Usage Policies"
337,34,"Limit monitoring to specific information or activities that are directly related to the legitimate business reason.","Establish Clear Usage Policies"
338,34,"Avoid overly intrusive monitoring practices that collect excessive data unrelated to the purpose.","Establish Clear Usage Policies"
339,34,"Implement strong data security measures to protect the privacy and security of employee internet usage and email data.","Establish Clear Usage Policies"
340,34,"Encrypt sensitive data and limit access to authorized personnel.","Establish Clear Usage Policies"
341,35,"Be transparent with customers about the collection and potential sharing of their data.","Transparency and Consent"
342,35,"Obtain clear and informed consent from customers before sharing their data with third parties.","Transparency and Consent"
343,35,"Maintain clear and comprehensive privacy policies that explain how customer data is collected, used, and shared.","Transparency and Consent"
344,35,"Ensure that privacy policies are easily accessible to customers.","Transparency and Consent"
345,35,"Ensure that any data sharing practices comply with all applicable privacy laws and regulations, such as the General Data Protection Regulation (GDPR) in Europe or the California Consumer Privacy Act (CCPA) in the United States.","Transparency and Consent"
346,35,"Implement robust data protection measures to safeguard customer data and prevent unauthorized access or breaches when sharing data with third parties.","Transparency and Consent"
347,35,"Limit the sharing of customer data to legitimate and necessary business purposes, avoiding sharing data with third parties for unrelated purposes.","Transparency and Consent"
348,35,"Consider anonymizing or pseudonymizing customer data before sharing it with third parties to protect individual identities.","Transparency and Consent"
349,35,"Provide customers with options and control over their data, including the ability to opt out of data sharing with third parties.","Transparency and Consent"
350,35,"Establish ethical data partnerships with third parties that adhere to strict data protection and privacy standards.","Transparency and Consent"
351,36,"Conduct thorough environmental impact assessments before implementing any business practices or processes to identify potential harm to the environment.","Environmental Impact Assessment"
352,36,"Ensure strict compliance with all environmental laws and regulations relevant to the business operations, including emissions standards, waste disposal, and natural resource management.","Environmental Impact Assessment"
353,36,"Transition to sustainable and environmentally friendly practices wherever possible, such as reducing energy consumption, using renewable resources, and minimizing waste.","Environmental Impact Assessment"
354,36,"Invest in and adopt technologies and processes that reduce environmental harm and minimize the ecological footprint.","Environmental Impact Assessment"
355,36,"Pursue and maintain certifications such as ISO 14001 (Environmental Management Systems) to demonstrate a commitment to environmental responsibility.","Environmental Impact Assessment"
356,36,"Implement strategies to reduce the organization's carbon footprint, including energy-efficient equipment, transportation alternatives, and telecommuting options.","Environmental Impact Assessment"
357,36,"Educate employees and stakeholders about the importance of environmental sustainability and the organization's efforts to minimize its impact.","Environmental Impact Assessment"
358,36,"Work with suppliers and partners who share a commitment to environmental responsibility and ethical business practices.","Environmental Impact Assessment"
359,36,"Be transparent about the organization's environmental impact and efforts to mitigate harm by regularly reporting on sustainability initiatives and progress.","Environmental Impact Assessment"
360,36,"Engage with local communities and environmental organizations to address concerns, build partnerships, and contribute to local environmental solutions.","Environmental Impact Assessment"
361,37,"Make a clear and unwavering commitment to compliance with all applicable environmental regulations and standards.","Commitment to Compliance"
362,37,"Ensure that all employees and stakeholders are aware of relevant environmental laws and regulations that pertain to the organization's operations.","Commitment to Compliance"
363,37,"Conduct thorough environmental impact assessments before starting or modifying any business activities to identify potential areas of non-compliance.","Commitment to Compliance"
364,37,"Implement an Environmental Management System (EMS) such as ISO 14001 to systematically manage environmental responsibilities and ensure compliance.","Commitment to Compliance"
365,37,"Establish processes to continuously monitor and stay informed about changes in environmental regulations and standards at the local, national, and international levels.","Commitment to Compliance"
366,37,"Provide training to employees at all levels on compliance with environmental regulations and standards.","Commitment to Compliance"
367,37,"Conduct regular environmental audits to assess and ensure compliance with regulations and standards.","Commitment to Compliance"
368,37,"Establish ethics committees or oversight boards responsible for reviewing and ensuring compliance with environmental regulations and standards.","Commitment to Compliance"
369,37,"Implement mechanisms for employees or stakeholders to report concerns about potential non-compliance without fear of retaliation.","Commitment to Compliance"
370,37,"Hold individuals and the organization accountable for any breaches of environmental regulations and standards, including legal consequences and penalties as prescribed by law.","Commitment to Compliance"
371,38,"Ensure that the company's commitment to sustainability is genuine and deeply embedded in its values, mission, and practices.","Authentic Commitment"
372,38,"Accurately communicate the company's sustainability efforts and achievements in marketing materials, reports, and public statements.","Authentic Commitment"
373,38,"Provide detailed and transparent reporting on sustainability initiatives, progress, and goals, including any challenges faced.","Authentic Commitment"
374,38,"Seek third-party verification or certification of the company's sustainability claims through recognized standards and organizations, such as the Global Reporting Initiative (GRI) or B Corp certification.","Authentic Commitment"
375,38,"Avoid "greenwashing," which involves making false or exaggerated sustainability claims for marketing purposes. Ensure that marketing and branding accurately reflect the company's actual sustainability practices.","Authentic Commitment"
376,38,"Establish ethics committees or oversight boards responsible for reviewing and verifying sustainability claims to ensure they align with ethical and truthful standards.","Authentic Commitment"
377,38,"Educate employees about the company's sustainability efforts and encourage their active participation and commitment.","Authentic Commitment"
378,38,"Engage with customers, investors, and stakeholders to share information about the company's sustainability initiatives and gather feedback.","Authentic Commitment"
379,38,"Set clear sustainability goals and targets that are measurable, achievable, and aligned with the company's values and mission.","Authentic Commitment"
380,38,"Conduct regular internal and external audits and assessments of sustainability practices to ensure they meet stated commitments.","Authentic Commitment"
381,39,"Develop and implement an integrated sustainability strategy that considers long-term environmental sustainability as a fundamental business objective.","Integrated Sustainability Strategy"
382,39,"Explore and adopt sustainable business models that align with environmental conservation and long-term profitability.","Integrated Sustainability Strategy"
383,39,"Adopt triple bottom line reporting, which assesses the company's performance not only in terms of financial profit but also social and environmental impact.","Integrated Sustainability Strategy"
384,39,"Establish key performance indicators (KPIs) and metrics that measure the company's environmental sustainability efforts and progress.","Integrated Sustainability Strategy"
385,39,"Demonstrate ethical leadership by prioritizing long-term environmental sustainability in decision-making processes and actions.","Integrated Sustainability Strategy"
386,39,"Communicate openly and transparently with stakeholders about the company's commitment to long-term sustainability and progress toward environmental goals.","Integrated Sustainability Strategy"
387,39,"Invest in green technologies and practices that reduce the company's environmental footprint and contribute to long-term sustainability.","Integrated Sustainability Strategy"
388,39,"Conduct thorough environmental risk assessments to identify potential risks associated with prioritizing short-term gains over long-term sustainability.","Integrated Sustainability Strategy"
389,39,"Engage with stakeholders, including investors, customers, employees, and the community, to incorporate their perspectives on long-term sustainability.","Integrated Sustainability Strategy"
390,39,"Collaborate with suppliers and partners to create a sustainable supply chain that aligns with environmental sustainability goals.","Integrated Sustainability Strategy"
391,40,"Ensure strict compliance with all applicable environmental laws and regulations related to hazardous waste disposal, including the Resource Conservation and Recovery Act (RCRA) in the United States.","Compliance with Environmental Laws"
392,40,"Develop and implement a comprehensive hazardous waste management plan that outlines proper disposal methods, storage procedures, and employee training.","Compliance with Environmental Laws"
393,40,"Store hazardous waste in appropriate containers and ensure proper labeling to prevent accidental spills or contamination.","Compliance with Environmental Laws"
394,40,"Provide training to employees on the safe handling, storage, and disposal of hazardous waste.","Compliance with Environmental Laws"
395,40,"Conduct thorough environmental impact assessments to identify potential harm or risks associated with hazardous waste disposal.","Compliance with Environmental Laws"
396,40,"Utilize licensed and certified hazardous waste disposal services to ensure proper treatment, recycling, or disposal of hazardous waste materials.","Compliance with Environmental Laws"
397,40,"Establish mechanisms for employees to report concerns about improper hazardous waste disposal without fear of retaliation.","Compliance with Environmental Laws"
398,40,"Establish ethics committees or oversight boards responsible for reviewing and approving waste disposal practices to ensure they align with ethical and legal standards.","Compliance with Environmental Laws"
399,40,"Hold individuals and the organization accountable for improper disposal of hazardous waste, including potential legal consequences and penalties.","Compliance with Environmental Laws"
400,40,"Demonstrate ethical leadership by prioritizing responsible hazardous waste management in decision-making processes and actions.","Compliance with Environmental Laws"
401,41,"Ensure that CSR initiatives are rooted in a genuine commitment to addressing social and environmental issues and creating lasting positive change.","Authentic Commitment"
402,41,"Align CSR efforts with the company's core values and mission, demonstrating a sincere dedication to corporate citizenship.","Authentic Commitment"
403,41,"Be transparent and honest about the motivations behind CSR initiatives, clearly communicating the company's goals and intentions to stakeholders.","Authentic Commitment"
404,41,"Focus on sustainable CSR initiatives that have a meaningful and lasting impact on society and the environment, rather than short-term, superficial projects.","Authentic Commitment"
405,41,"Involve stakeholders, including employees, customers, and the community, in the development and execution of CSR programs to ensure they address real needs and concerns.","Authentic Commitment"
406,41,"Establish clear metrics and performance indicators to measure the impact of CSR initiatives and regularly report progress to stakeholders.","Authentic Commitment"
407,41,"Seek independent verification or certification for CSR initiatives to demonstrate their authenticity and adherence to recognized standards.","Authentic Commitment"
408,41,"Avoid "greenwashing" or making false or exaggerated claims about CSR efforts for marketing purposes. Ensure that CSR communications accurately reflect the company's actions.","Authentic Commitment"
409,41,"Engage employees in CSR activities, allowing them to participate actively and contribute their skills and expertise.","Authentic Commitment"
410,41,"Prioritize initiatives that directly benefit the communities and causes being supported, focusing on their actual needs and concerns.","Authentic Commitment"
411,42,"Rather than using CSR initiatives to distract from unethical behavior, address and rectify unethical practices within the company promptly.","Address Unethical Practices Directly"
412,42,"Be transparent and honest about any past or ongoing unethical practices, and communicate the company's commitment to rectifying those practices.","Address Unethical Practices Directly"
413,42,"Demonstrate ethical leadership by taking responsibility for unethical actions, apologizing when necessary, and outlining a clear plan for ethical improvements.","Address Unethical Practices Directly"
414,42,"Consider involving independent third-party organizations or experts to assess and monitor the company's ethical improvements.","Address Unethical Practices Directly"
415,42,"Make a genuine, long-term commitment to ethical business practices that go beyond CSR initiatives and encompass all aspects of the organization.","Address Unethical Practices Directly"
416,42,"Establish measurable benchmarks and timelines for addressing unethical practices and regularly report on progress.","Address Unethical Practices Directly"
417,42,"Engage with stakeholders, including employees, customers, investors, and the community, to gather input and build trust in the company's ethical transformation.","Address Unethical Practices Directly"
418,42,"Establish ethics committees or oversight boards responsible for reviewing and guiding the company's ethical transformation.","Address Unethical Practices Directly"
419,42,"Avoid using CSR initiatives or sustainability efforts as a way to divert attention from unethical actions. Ensure that CSR communications accurately reflect the company's commitment to ethical change.","Address Unethical Practices Directly"
420,42,"Educate employees about the importance of ethical conduct and their role in upholding ethical values within the organization.","Address Unethical Practices Directly"
421,43,"Ensure that charitable donations are rooted in a genuine commitment to supporting causes that align with the company's values and mission.","Genuine Commitment to Charitable Causes"
422,43,"Be transparent about the motivations behind charitable giving, and communicate the company's true intentions to stakeholders.","Genuine Commitment to Charitable Causes"
423,43,"Commit to sustained support for charitable organizations and causes, rather than making one-off donations solely for damage control.","Genuine Commitment to Charitable Causes"
424,43,"Involve stakeholders, including employees, customers, and the community, in decisions about charitable giving to ensure alignment with their values and concerns.","Genuine Commitment to Charitable Causes"
425,43,"Establish clear metrics and performance indicators to measure the impact of charitable donations and regularly report on progress to stakeholders.","Genuine Commitment to Charitable Causes"
426,43,"Avoid "virtue signaling" or making insincere public displays of charity solely for positive PR. Focus on the substantive impact of donations.","Genuine Commitment to Charitable Causes"
427,43,"Demonstrate ethical leadership by prioritizing ethical behavior in all aspects of the organization's operations, including charitable giving.","Genuine Commitment to Charitable Causes"
428,43,"Establish ethics committees or oversight boards responsible for reviewing and guiding the company's charitable giving practices to ensure they align with ethical standards.","Genuine Commitment to Charitable Causes"
429,43,"Encourage employees to participate in the selection and support of charitable causes through volunteer programs or donation matching.","Genuine Commitment to Charitable Causes"
430,43,"Make a long-term commitment to supporting charitable causes that reflect the company's values and priorities.","Genuine Commitment to Charitable Causes"
431,44,"Ensure that CSR efforts align with the company's core values and mission, as well as the expectations of stakeholders.","Alignment with Core Values"
432,44,"Prioritize ethical decision-making by considering the impact of CSR initiatives on stakeholders, society, and the environment.","Alignment with Core Values"
433,44,"Be transparent and honest about the motivations behind CSR efforts, clearly communicating the company's goals and intentions to stakeholders.","Alignment with Core Values"
434,44,"Involve stakeholders, including employees, customers, investors, and the community, in decisions about CSR initiatives to ensure alignment with their values and concerns.","Alignment with Core Values"
435,44,"Establish clear metrics and performance indicators to measure the impact of CSR initiatives and regularly report progress to stakeholders.","Alignment with Core Values"
436,44,"Avoid "greenwashing" or making false or exaggerated claims about CSR efforts that do not align with the company's core values. Ensure that CSR communications accurately reflect the company's actions.","Alignment with Core Values"
437,44,"Demonstrate ethical leadership by prioritizing ethical values in decision-making processes and actions related to CSR.","Alignment with Core Values"
438,44,"Establish ethics committees or oversight boards responsible for reviewing and approving CSR initiatives to ensure they align with ethical and value-driven standards.","Alignment with Core Values"
439,44,"Focus on sustainability and make a long-term commitment to CSR efforts that reflect the company's values and priorities.","Alignment with Core Values"
440,44,"Periodically reassess the company's CSR strategy to ensure that it remains aligned with evolving values and societal expectations.","Alignment with Core Values"
441,45,"Conduct a thorough review of CSR commitments and consider whether adjustments are needed to align with the company's financial realities without abandoning its ethical principles.","Review and Adjust Commitments"
442,45,"Communicate openly and transparently with stakeholders, including employees, customers, investors, and the community, about the financial challenges the company is facing and its impact on CSR initiatives.","Review and Adjust Commitments"
443,45,"Identify and prioritize essential CSR commitments that have the most significant positive impact on society, the environment, and stakeholders, even in financially challenging times.","Review and Adjust Commitments"
444,45,"Engage with stakeholders to gather input and seek their understanding and support for any necessary adjustments to CSR commitments.","Review and Adjust Commitments"
445,45,"Focus on CSR initiatives that can deliver measurable and meaningful impact, ensuring that resources are directed where they are most needed.","Review and Adjust Commitments"
446,45,"Efficiently allocate resources to balance financial stability and CSR commitments, considering alternative ways to achieve CSR goals with limited resources.","Review and Adjust Commitments"
447,45,"Collaborate with other organizations, nonprofits, or government agencies to share resources and expertise to continue fulfilling CSR commitments.","Review and Adjust Commitments"
448,45,"Involve employees in CSR efforts and seek their creative solutions and voluntary contributions during tough financial times.","Review and Adjust Commitments"
449,45,"Maintain a long-term perspective by considering the potential consequences of abandoning CSR commitments, including reputational damage and loss of trust.","Review and Adjust Commitments"
450,45,"Prioritize sustainability efforts that align with both financial stability and CSR goals, emphasizing initiatives that can contribute to long-term profitability.","Review and Adjust Commitments"