id,question_id,answer,domain
1,1,"Ensure that senior leaders and executives model ethical behavior and prioritize employee well-being.","Prioritize Ethical Leadership"
2,1,"Develop a strong ethical leadership culture that values employees as integral to the organization's success.","Prioritize Ethical Leadership"
3,1,"Define and communicate a set of ethical values that include a commitment to employee well-being and safety.","Establish Clear Ethical Values"
4,1,"Embed these values in the organization's mission and vision statements.","Establish Clear Ethical Values"
5,1,"Allocate resources to support employee well-being programs, such as mental health initiatives, wellness programs, and ergonomic workplace designs.","Invest in Employee Well-Being"
6,1,"Consider offering flexible work arrangements to promote work-life balance.","Invest in Employee Well-Being"
7,1,"Encourage open and honest communication between employees and management.","Foster Open Communication"
8,1,"Create channels for employees to voice concerns or suggestions related to their well-being.","Foster Open Communication"
9,1,"Recognize that long-term profitability is often linked to employee well-being. A satisfied and engaged workforce can boost productivity, innovation, and customer satisfaction.","Balance Profit and Well-Being"
10,1,"Avoid short-term thinking that sacrifices well-being for immediate financial gains.","Balance Profit and Well-Being"
11,2,"Develop and communicate a clear commitment to environmental sustainability, embedding it in the company's mission and values.","Sustainability Commitment"
12,2,"Prior to making decisions, conduct comprehensive environmental impact assessments (EIAs) to identify potential harm and explore alternative options.","Environmental Impact Assessment"
13,2,"Ensure full compliance with local, national, and international environmental laws and regulations.","Regulatory Compliance"
14,2,"Stay informed about evolving environmental legislation and make necessary adjustments.","Regulatory Compliance"
15,2,"Collaborate with suppliers who demonstrate a commitment to sustainable practices and ethical sourcing.","Sustainable Sourcing and Supply Chain"
16,2,"Assess the environmental impact of products and materials used in production and seek alternatives that are more eco-friendly.","Sustainable Sourcing and Supply Chain"
15,2,"Implement resource-efficient practices to reduce waste, energy consumption, and water usage in operations.","Resource Efficiency"
16,2,"Invest in energy-efficient technologies and renewable energy sources.","Resource Efficiency"
17,2,"Develop products and services with a focus on environmental sustainability, considering their entire lifecycle, from production to disposal.","Green Product Design"
18,2,"Invest in carbon offset programs and initiatives to mitigate the organization's carbon footprint.","Carbon Offsetting and Mitigation"
19,2,"Support reforestation, renewable energy projects, or other environmentally beneficial activities.","Carbon Offsetting and Mitigation"
20,2,"Ensure that marketing materials accurately represent the organization's commitment to environmental sustainability.","Ethical Marketing and Communication"
21,3,"Make ethical marketing principles a cornerstone of your company's culture and values.","Embrace Ethical Marketing Principles"
22,3,"Clearly communicate these principles to all employees involved in marketing and sales.","Embrace Ethical Marketing Principles"
23,3,"Ensure that all marketing materials, advertisements, and product descriptions are transparent, accurate, and free from misleading information.","Transparency and Honesty"
24,3,"Avoid exaggerations, false claims, and deceptive imagery in marketing campaigns.","Transparency and Honesty"
25,3,"Comply with advertising laws and regulations, including those related to false advertising and consumer protection.","Truth in Advertising"
26,3,"Verify the accuracy of all product or service claims before promoting them.","Truth in Advertising"
27,3,"Prioritize the needs and interests of customers over short-term sales goals.","Customer-Centric Approach"
28,3,"Develop products and services that genuinely meet customer needs and provide value.","Customer-Centric Approach"
29,3,"Price products or services fairly, avoiding hidden fees, price gouging, or artificial price inflation.","Ethical Pricing"
30,3,"Offer competitive and reasonable pricing while maintaining profitability.","Ethical Pricing"
31,4,"Before collecting any employee data beyond what is necessary for HR management, obtain informed consent from employees. Clearly explain the purpose of data collection, how it will be used, and the potential consequences.","Obtain Informed Consent"
32,4,"Only collect employee data that is necessary for legitimate HR purposes. Avoid collecting excessive or irrelevant information.","Limit Data Collection"
33,4,"Regularly review and assess the data collected to ensure it remains relevant and necessary.","Limit Data Collection"
34,4,"Comply with data protection laws and regulations, such as GDPR or CCPA, that govern the handling of employee data.","Data Protection Compliance"
35,4,"Implement robust data protection measures, including encryption, access controls, and secure storage, to safeguard employee data.","Data Protection Compliance"
34,4,"Maintain transparent communication with employees regarding data handling practices.","Transparency and Communication"
35,4,"Inform employees about their rights regarding their personal data, including the right to access, correct, or delete it.","Transparency and Communication"
36,4,"Use employee data only for the specific purposes for which it was collected and disclosed.","Purpose Limitation"
37,4,"Avoid using employee data for purposes unrelated to employment or HR management without explicit consent or a legitimate reason.","Purpose Limitation"
38,4,"Minimize the retention of employee data to the shortest necessary period.","Data Minimization"
39,4,"Implement data deletion or anonymization policies to remove data that is no longer needed for HR purposes.","Data Minimization"
40,4,"Develop and implement internal policies and procedures that govern the ethical use of employee data.","Internal Policies and Training"
41,5,"Establish a culture of transparency where information about changes that impact employees is shared openly and honestly.","Transparent Communication"
42,5,"Provide clear and timely updates regarding organizational changes, policies, and procedures.","Transparent Communication"
43,5,"Involve employees in the decision-making process when feasible. Seek their input and feedback on changes that may affect them.","Employee Engagement"
44,5,"Create forums or channels for employees to voice concerns, ask questions, and provide suggestions.","Employee Engagement"
45,5,"Whenever possible, provide employees with advance notice of impending changes. This allows them to prepare and adapt to the new circumstances.","Advance Notice"
46,5,"Be considerate of the timing and methods used to communicate changes.","Advance Notice"
47,5,"Clearly explain the reasons behind the changes, the expected impacts, and the benefits to both the organization and employees.","Clear Explanations"
48,5,"Address potential concerns or uncertainties proactively.","Clear Explanations"
49,5,"Make information easily accessible to all employees through channels such as company-wide emails, intranet portals, or meetings.","Accessibility of Information"
50,5,"Ensure that information is presented in a way that is understandable to all employees, regardless of their role or background.","Accessibility of Information"
51,6,"Develop and communicate a clear equal opportunity employment policy that prohibits discrimination based on age, along with other protected characteristics (such as race, gender, religion, etc.).","Equal Opportunity Employment Policy"
52,6,"Create diverse hiring panels or committees that include individuals from various age groups to review and select candidates.","Diverse Hiring Teams"
53,6,"Encourage diverse perspectives in the hiring process to reduce the likelihood of age bias.","Diverse Hiring Teams"
54,6,"Implement blind recruitment techniques, where applicant information such as age, name, and graduation dates is removed from initial application materials.","Blind Recruitment"
55,6,"Focus solely on qualifications and skills during the initial screening process.","Blind Recruitment"
56,6,"Provide training to hiring managers and recruiters on the importance of age diversity and the consequences of age discrimination.","Training and Awareness"
57,6,"Raise awareness about unconscious bias that may lead to age-related discrimination.","Training and Awareness"
58,6,"Establish clear and objective hiring criteria based on job-related skills, qualifications, and competencies.","Objective Hiring Criteria"
59,6,"Ensure that these criteria are consistently applied to all candidates regardless of age.","Objective Hiring Criteria"
60,6,"Conduct regular audits of hiring practices to identify and rectify any age-related biases.","Regular Audits and Monitoring"
61,7,"Develop clear and comprehensive termination policies and procedures that outline the criteria for termination and the steps to be followed.","Establish Clear Termination Policies"
62,7,"Require that terminations be based on justifiable and documented reasons, such as poor performance, violation of company policies, or legitimate restructuring needs.","Proper Cause Requirement"
63,7,"Ensure that employees are provided with due process, which may include notice, a fair hearing, an opportunity to respond to allegations, and a chance for improvement.","Due Process"
64,7,"Follow legal requirements and contractual obligations related to due process.","Due Process"
65,7,"Maintain thorough records of an employee's performance, behavior, or conduct issues, as well as any corrective actions taken.","Documentation"
66,7,"Document the reasons for termination, ensuring that they are clear and supported by evidence.","Documentation"
67,7,"Apply termination policies consistently and equitably to all employees, regardless of their position or tenure.","Consistency"
68,7,"Avoid favoritism or discriminatory practices in termination decisions.","Consistency"
69,7,"Communicate the reasons for termination to the employee in a respectful and empathetic manner, providing an opportunity for questions and discussion.","Notification and Communication"
70,7,"Notify the employee in writing and provide information about their rights and entitlements.","Notification and Communication"
71,8,"Establish performance targets that are challenging but realistic, taking into account the capabilities and resources available to employees.","Ethical Goal Setting"
72,8,"Avoid setting targets that are intentionally unattainable or that promote unhealthy competition among employees.","Ethical Goal Setting"
73,8,"Involve employees in the goal-setting process to gain their input and perspective on what is achievable.","Consult with Employees"
74,8,"Encourage open and honest communication about the feasibility of performance targets.","Consult with Employees"
75,8,"Conduct regular performance reviews that allow employees and managers to discuss progress toward goals.","Regular Performance Reviews"
76,8,"Adjust targets if they are consistently unrealistic or if unforeseen circumstances arise.","Regular Performance Reviews"
77,8,"Ensure that employees have the necessary resources, tools, and support to meet their performance targets.","Resource Allocation"
78,8,"Adjust targets if they are consistently unrealistic or if unforeseen circumstances arise.","Resource Allocation"
79,8,"Invest in employee training and development to enhance their skills and capabilities, enabling them to meet challenging goals more effectively.","Training and Development"
80,8,"Use a balanced set of performance metrics that consider both quantitative and qualitative aspects of an employee's work.","Balanced Metrics"
81,9,"Create clear and accessible channels for employees to report harassment, discrimination, or any other workplace concerns.","Establish Robust Reporting Mechanisms"
82,9,"Ensure that employees know how to use these reporting mechanisms and understand their rights.","Establish Robust Reporting Mechanisms"
83,9,"Implement strong whistleblower protection policies that safeguard employees who report misconduct from retaliation.","Whistleblower Protection"
84,9,"Guarantee anonymity for those who prefer to remain confidential when reporting.","Whistleblower Protection"
85,9,"Commit to conducting thorough and impartial investigations of all complaints. Investigations should be prompt and unbiased.","Thorough and Prompt Investigations"
86,9,"Ensure that investigations are handled by individuals trained in addressing harassment and discrimination issues.","Thorough and Prompt Investigations"
87,9,"Maintain transparency in the investigation process. Keep complainants informed of the progress and outcomes of their complaints.","Transparency and Communication"
88,9,"Communicate anti-harassment and anti-discrimination policies and procedures regularly to all employees.","Transparency and Communication"
89,9,"Provide access to counseling and support services for employees who have experienced harassment or discrimination.","Employee Support Services"
90,9,"Offer resources for emotional and psychological well-being.","Employee Support Services"
91,10,"Promote a merit-based system where promotions are awarded based on employees' skills, qualifications, performance, and contributions to the organization.","Merit-Based Promotions"
92,10,"Develop clear and objective evaluation criteria for promotions, ensuring that they are consistently applied to all candidates.","Objective Evaluation Criteria"
93,10,"Use data-driven assessments and performance metrics to make promotion decisions.","Objective Evaluation Criteria"
94,10,"Communicate the promotion process, criteria, and timelines openly to all employees to create a sense of fairness and trust.","Transparency and Communication"
95,10,"Encourage employees to seek feedback on their performance and career development.","Transparency and Communication"
96,10,"Invest in training and development programs to help employees acquire the skills and competencies needed for advancement.","Training and Development"
97,10,"Provide resources and support for career growth.","Training and Development"
98,10,"Promote diversity and inclusion in the workplace to ensure that opportunities are accessible to employees from all backgrounds.","Diversity and Inclusion"
99,10,"Monitor and address any disparities in promotions based on demographic factors.","Diversity and Inclusion"
100,10,"Hold managers and decision-makers accountable for making objective and ethical promotion decisions.","Management Accountability"
101,11,"Always acknowledge and give credit to the employee or team responsible for a particular achievement, idea, or project.","Give Credit Where It's Due"
102,11,"Emphasize the collective effort that goes into achieving success.","Give Credit Where It's Due"
103,11,"Maintain open and transparent communication about individual and team contributions within the organization.","Transparent Communication"
104,11,"Encourage employees to share their achievements and recognize their colleagues.","Transparent Communication"
105,11,"Implement performance recognition programs that highlight and reward individual and team accomplishments.","Performance Recognition Programs"
106,11,"Ensure that these programs are based on fair and objective criteria.","Performance Recognition Programs"
107,11,"Hold managers and leaders accountable for ethical behavior and giving credit appropriately.","Managerial Accountability"
108,11,"Provide training on ethical leadership and the importance of acknowledging employee contributions.","Managerial Accountability"
109,11,"Establish channels for employees to provide feedback and report instances of credit-taking or unethical behavior.","Feedback Channels"
110,11,"Address concerns promptly and transparently, ensuring protection for whistleblowers.","Feedback Channels"
111,12,"Be transparent and honest in your actions and interactions with colleagues. Avoid deceit, manipulation, or spreading false information.","Transparency and Honesty"
112,12,"Respect ethical boundaries, such as avoiding unethical behavior, conflicts of interest, or favoritism.","Ethical Boundaries"
113,12,"Prioritize honesty and integrity in your professional interactions.","Ethical Boundaries"
114,12,"Uphold high standards of professionalism in your conduct, treating all colleagues with respect and fairness.","Professionalism"
115,12,"Avoid undermining or sabotaging others for personal gain.","Professionalism"
116,12,"Focus on improving your skills, competence, and performance as a primary means of advancing your career.","Merit and Competence"
117,12,"Seek recognition based on merit and contributions rather than political maneuvering.","Merit and Competence"
118,12,"Build positive and constructive relationships with colleagues, supervisors, and mentors.","Positive Networking"
119,12,"Network to gain knowledge, support, and mentorship rather than solely for personal gain.","Positive Networking"
120,12,"Address conflicts or disagreements professionally and ethically. Seek resolution through open communication and collaboration rather than resorting to manipulation.","Conflict Resolution"
121,13,"Establish clear ethical guidelines and communication policies within the organization to guide leaders in determining when information can be confidential and when it should be shared with the team.","Clear Ethical Guidelines"
122,13,"As a general rule, prioritize transparency and open communication with the team. Share information that is relevant to their roles, responsibilities, and overall well-being.","Transparency by Default"
123,13,"Ensure that withholding information complies with legal requirements and ethical standards. Some situations may necessitate confidentiality due to legal obligations (e.g., protecting sensitive employee data).","Legal and Ethical Compliance"
124,13,"Evaluate the potential risks and benefits of concealing information from the team. Consider the impact on trust, morale, and productivity.","Risk Assessment"
125,13,"Develop communication plans that outline when and how sensitive or confidential information will be shared with the team. Be clear about the reasons for withholding information and the expected timeline for disclosure.","Communication Plans"
126,13,"Limit the information shared with the team to what they need to know to perform their jobs effectively. Avoid sharing confidential information that is irrelevant to their roles.","Need-to-Know Basis"
127,13,"If information must be withheld, communicate the reasons for the decision clearly and honestly. Reassure the team that confidentiality is necessary to protect their interests or the organization's interests.","Maintain Trust"
128,13,"Whenever possible, disclose withheld information as soon as it is no longer necessary to keep it confidential. Prompt disclosure can help rebuild trust.","Timely Disclosure"
129,13,"Hold leaders accountable for their decisions regarding information disclosure. Encourage them to justify their actions and adhere to ethical principles.","Accountability"
130,13,"Establish mechanisms for employees to report concerns about information concealment or unethical behavior.","Whistleblower Protection"
131,14,"Adopt a leadership style that prioritizes ethical principles, including fairness, honesty, transparency, and respect for others.","Embrace Ethical Leadership Principles"
132,14,"Establish clear ethical guidelines and codes of conduct within the organization that explicitly discourage fear and intimidation as management tactics.","Clear Ethical Guidelines"
133,14,"Provide leadership training to managers and supervisors, emphasizing the importance of ethical leadership practices and the detrimental effects of fear-based management.","Leadership Training"
134,14,"Train managers in effective communication skills, conflict resolution, and constructive feedback techniques to foster healthy relationships with employees.","Communication Skills"
135,14,"Implement formal conflict resolution mechanisms within the organization to address employee concerns and grievances in a fair and impartial manner.","Conflict Resolution Mechanisms"
136,14,"Hold managers and leaders accountable for their behavior and actions, ensuring they align with the organization's ethical standards.","Accountability"
137,14,"Implement consequences for unethical behavior, including fear-based tactics.","Accountability"
138,14,"Promote positive leadership styles that focus on coaching, mentoring, and empowerment rather than fear and control.","Positive Leadership Styles"
139,14,"Encourage managers to build trust and rapport with their teams.","Positive Leadership Styles"
140,14,"Encourage open and honest feedback from employees about their managers' leadership styles and practices.","Regular Feedback"
141,15,"Promote transparency in the allocation of resources and opportunities, ensuring that the process is clearly defined and fair.","Transparency and Fairness"
142,15,"Communicate the criteria used for resource allocation to all stakeholders.","Transparency and Fairness"
143,15,"Develop and communicate clear guidelines and policies regarding resource allocation to prevent favoritism.","Establish Clear Guidelines"
144,15,"Ensure that these guidelines are consistently applied to all employees.","Establish Clear Guidelines"
145,15,"Base resource allocation decisions on merit, performance, qualifications, and objective criteria rather than personal preferences.","Merit-Based Allocation"
146,15,"Prioritize those who are best suited for the resources or opportunities.","Merit-Based Allocation"
147,15,"Implement objective evaluation processes for determining who receives resources or opportunities, eliminating subjectivity and bias.","Objective Evaluation"
148,15,"Use data-driven assessments when applicable.","Objective Evaluation"
149,15,"Ensure that all eligible employees have equal access to information about available resources or opportunities.","Equal Access"
150,15,"Avoid exclusive access or undisclosed opportunities.","Equal Access"
151,16,"Develop and adhere to a code of ethics that guides the company's approach to taxation, emphasizing compliance with both the letter and the spirit of tax laws.","Ethical Tax Practices"
152,16,"Be transparent about the company's tax practices and disclose the use of any tax loopholes in financial reports and statements.","Transparency and Disclosure"
153,16,"Ensure that all tax planning strategies, including the use of tax loopholes, fully comply with applicable tax laws and regulations.","Legal Compliance"
154,16,"Engage tax professionals to provide expertise in tax compliance.","Legal Compliance"
155,16,"Engage with stakeholders, including shareholders, customers, and the public, to discuss the company's tax practices and address concerns.","Stakeholder Engagement"
156,16,"Consider their perspectives and feedback when making tax-related decisions.","Stakeholder Engagement"
157,16,"Embrace corporate social responsibility (CSR) principles that emphasize contributing to the well-being of society, including paying a fair share of taxes.","Social Responsibility"
158,16,"Actively support efforts to advocate for tax reform that addresses tax loopholes and promotes a fair and equitable tax system.","Advocate for Tax Reform"
159,16,"Collaborate with industry associations and policymakers to drive meaningful change.","Advocate for Tax Reform"
160,16,"Adopt tax fairness principles that guide the company's approach to taxation, ensuring that tax practices align with the broader public interest.","Tax Fairness Principles"
161,17,"Ensure strict compliance with antitrust and competition laws in all business practices, including pricing strategies and agreements with competitors.","Compliance with Antitrust Laws"
162,17,"Establish clear ethical guidelines and codes of conduct within the organization that explicitly prohibit price-fixing and anti-competitive behavior.","Ethical Guidelines"
163,17,"Provide employees, especially those involved in sales, pricing, and negotiations, with training on antitrust laws and the ethical implications of price-fixing.","Education and Training"
164,17,"Encourage employees to gather competitive intelligence legally and ethically, focusing on understanding market dynamics and customer needs rather than collusion.","Competitive Intelligence"
165,17,"Create mechanisms for employees to report concerns about potential price-fixing or anti-competitive behavior within the organization.","Whistleblower Protection"
166,17,"Ensure that whistleblowers are protected from retaliation.","Whistleblower Protection"
167,17,"Lead by example, demonstrating a commitment to ethical business practices and adherence to antitrust laws.","Ethical Leadership"
168,17,"Maintain transparency in pricing strategies and communicate openly with customers and stakeholders about the factors that influence pricing decisions.","Transparent Pricing"
169,17,"Compete in the marketplace based on the merit of your products, services, and customer value rather than through collusion with competitors.","Compete on Merit"
170,17,"Conduct regular audits and assessments of business practices to identify and prevent any potential antitrust violations.","Regular Compliance Audits"
171,18,"Ensure that all testimonials used in marketing materials accurately reflect the experiences and opinions of real customers.","Truthful and Accurate Testimonials"
172,18,"Avoid fabricating or exaggerating testimonials.","Truthful and Accurate Testimonials"
